323, Employee 323, Java, Kubernetes, HTML, SQL, Docker, Time management, Time management, Adaptability, Teamwork, Decision-making, Needs to improve attention to detail,
324, Employee 324, Azure, JavaScript, SQL, SQL, Kubernetes, Adaptability, Problem-solving, Time management, Teamwork, Teamwork, Excellent teamwork,
325, Employee 325, CSS, CSS, CSS, JavaScript, AWS, Problem-solving, Problem-solving, Decision-making, Time management, Teamwork, Very creative,
326, Employee 326, Docker, Kubernetes, JavaScript, Docker, HTML, Decision-making, Teamwork, Teamwork, Adaptability, Leadership, Needs improvement in time management,
327, Employee 327, Azure, HTML, Java, HTML, Docker, Conflict resolution, Time management, Conflict resolution, Critical thinking, Decision-making, Needs to work on problem-solving skills,
328, Employee 328, Docker, Python, JavaScript, SQL, HTML, Time management, Creativity, Conflict resolution, Conflict resolution, Communication, Very creative,
329, Employee 329, AWS, JavaScript, Azure, Python, Python, Teamwork, Conflict resolution, Conflict resolution, Conflict resolution, Problem-solving, Excellent teamwork,
330, Employee 330, SQL, HTML, SQL, Java, SQL, Time management, Creativity, Decision-making, Leadership, Teamwork, Leadership potential,
331, Employee 331, SQL, Azure, JavaScript, AWS, JavaScript, Creativity, Problem-solving, Creativity, Problem-solving, Creativity, Needs to work on problem-solving skills,
332, Employee 332, SQL, HTML, JavaScript, Kubernetes, AWS, Communication, Critical thinking, Decision-making, Creativity, Time management, Needs improvement in time management,
333, Employee 333, Docker, Kubernetes, Azure, Python, Java, Teamwork, Leadership, Conflict resolution, Leadership, Time management, Needs to improve attention to detail,
334, Employee 334, Kubernetes, SQL, Java, JavaScript, Docker, Leadership, Decision-making, Adaptability, Communication, Problem-solving, Good communication skills,
335, Employee 335, JavaScript, HTML, Java, CSS, Docker, Leadership, Time management, Critical thinking, Communication, Creativity, Very creative,
336, Employee 336, Docker, Azure, CSS, Kubernetes, AWS, Decision-making, Adaptability, Time management, Decision-making, Time management, Great work!,
337, Employee 337, JavaScript, Python, Docker, SQL, AWS, Leadership, Conflict resolution, Communication, Time management, Adaptability, Needs to work on problem-solving skills,
338, Employee 338, SQL, SQL, JavaScript, Python, Python, Teamwork, Adaptability, Conflict resolution, Problem-solving, Decision-making, Very creative,
339, Employee 339, SQL, HTML, AWS, SQL, SQL, Problem-solving, Leadership, Leadership, Time management, Creativity, Needs improvement in time management,
340, Employee 340, Kubernetes, Azure, Kubernetes, CSS, Docker, Creativity, Teamwork, Problem-solving, Critical thinking, Decision-making, Needs to work on problem-solving skills,
341, Employee 341, AWS, JavaScript, Docker, AWS, Java, Decision-making, Teamwork, Time management, Decision-making, Communication, Very creative,
342, Employee 342, CSS, Azure, HTML, JavaScript, Azure, Creativity, Adaptability, Adaptability, Communication, Communication, Needs to improve attention to detail,
343, Employee 343, Docker, CSS, Python, Java, SQL, Time management, Decision-making, Adaptability, Communication, Leadership, Shows good decision-making skills,
344, Employee 344, HTML, Python, CSS, Java, Java, Critical thinking, Critical thinking, Critical thinking, Leadership, Teamwork, Leadership potential,
345, Employee 345, Python, Python, HTML, JavaScript, Java, Communication, Critical thinking, Decision-making, Problem-solving, Teamwork, Needs improvement in time management,
346, Employee 346, CSS, Kubernetes, JavaScript, JavaScript, HTML, Conflict resolution, Time management, Critical thinking, Communication, Critical thinking, Good communication skills,
347, Employee 347, JavaScript, HTML, HTML, Kubernetes, SQL, Adaptability, Communication, Time management, Decision-making, Decision-making, Excellent teamwork,
348, Employee 348, SQL, Azure, AWS, CSS, Azure, Decision-making, Problem-solving, Problem-solving, Creativity, Problem-solving, Needs to work on problem-solving skills,
349, Employee 349, Azure, AWS, Python, HTML, JavaScript, Problem-solving, Teamwork, Communication, Conflict resolution, Problem-solving, Good communication skills,
350, Employee 350, CSS, Java, JavaScript, Kubernetes, Kubernetes, Decision-making, Teamwork, Decision-making, Creativity, Communication, Needs to improve attention to detail,
351, Employee 351, Azure, Docker, Docker, Java, HTML, Communication, Decision-making, Creativity, Creativity, Decision-making, Adapts well to changes,
352, Employee 352, SQL, CSS, Azure, Python, Java, Creativity, Problem-solving, Conflict resolution, Critical thinking, Problem-solving, Adapts well to changes,
353, Employee 353, Azure, Docker, Docker, Java, JavaScript, Adaptability, Problem-solving, Time management, Critical thinking, Problem-solving, Needs to improve attention to detail,
354, Employee 354, Java, SQL, AWS, Kubernetes, SQL, Conflict resolution, Leadership, Critical thinking, Decision-making, Leadership, Excellent teamwork,
355, Employee 355, HTML, JavaScript, Python, AWS, Azure, Decision-making, Critical thinking, Communication, Problem-solving, Critical thinking, Needs to improve attention to detail,
356, Employee 356, JavaScript, Java, HTML, HTML, Azure, Communication, Leadership, Problem-solving, Critical thinking, Time management, Needs improvement in time management,
357, Employee 357, Java, JavaScript, Python, HTML, Docker, Leadership, Time management, Time management, Conflict resolution, Leadership, Very creative,
358, Employee 358, Azure, JavaScript, Java, Java, CSS, Adaptability, Time management, Critical thinking, Teamwork, Time management, Needs to work on problem-solving skills,
359, Employee 359, CSS, Docker, AWS, HTML, Python, Creativity, Teamwork, Communication, Communication, Communication, Needs to improve attention to detail,
360, Employee 360, Python, Azure, Docker, Kubernetes, Docker, Decision-making, Adaptability, Creativity, Teamwork, Critical thinking, Needs to improve attention to detail,
361, Employee 361, Java, Java, Docker, Kubernetes, HTML, Leadership, Problem-solving, Critical thinking, Adaptability, Decision-making, Excellent teamwork,
362, Employee 362, JavaScript, Java, SQL, HTML, SQL, Teamwork, Adaptability, Conflict resolution, Communication, Problem-solving, Leadership potential,
363, Employee 363, Python, Python, AWS, Kubernetes, Docker, Teamwork, Communication, Conflict resolution, Conflict resolution, Leadership, Good communication skills,
364, Employee 364, JavaScript, Kubernetes, SQL, CSS, AWS, Time management, Teamwork, Creativity, Critical thinking, Time management, Needs to work on problem-solving skills,
365, Employee 365, Kubernetes, Azure, JavaScript, Kubernetes, Python, Adaptability, Teamwork, Communication, Problem-solving, Creativity, Needs to work on problem-solving skills,
366, Employee 366, JavaScript, Python, AWS, SQL, Python, Communication, Teamwork, Critical thinking, Problem-solving, Problem-solving, Needs improvement in time management,
367, Employee 367, Docker, AWS, JavaScript, JavaScript, Azure, Teamwork, Teamwork, Teamwork, Teamwork, Leadership, Needs to work on problem-solving skills,
368, Employee 368, JavaScript, SQL, JavaScript, HTML, HTML, Conflict resolution, Adaptability, Adaptability, Critical thinking, Time management, Needs to improve attention to detail,
369, Employee 369, AWS, AWS, SQL, AWS, AWS, Problem-solving, Decision-making, Teamwork, Time management, Conflict resolution, Great work!,
370, Employee 370, Python, CSS, SQL, Azure, Docker, Conflict resolution, Leadership, Communication, Communication, Adaptability, Great work!,
371, Employee 371, Kubernetes, HTML, SQL, Python, Java, Adaptability, Communication, Leadership, Communication, Time management, Adapts well to changes,
372, Employee 372, Java, HTML, Azure, AWS, CSS, Creativity, Conflict resolution, Decision-making, Problem-solving, Adaptability, Needs to improve attention to detail,
373, Employee 373, Azure, Kubernetes, HTML, Azure, Azure, Communication, Leadership, Time management, Teamwork, Critical thinking, Great work!,
374, Employee 374, HTML, Azure, Java, HTML, Kubernetes, Adaptability, Creativity, Leadership, Adaptability, Teamwork, Adapts well to changes,
375, Employee 375, HTML, Kubernetes, HTML, Azure, Python, Teamwork, Time management, Teamwork, Problem-solving, Time management, Needs improvement in time management,
376, Employee 376, HTML, Python, Azure, Azure, AWS, Adaptability, Creativity, Critical thinking, Communication, Teamwork, Good communication skills,
377, Employee 377, Java, Java, Azure, CSS, JavaScript, Leadership, Communication, Time management, Leadership, Problem-solving, Very creative,
378, Employee 378, Kubernetes, Azure, Azure, Azure, CSS, Creativity, Adaptability, Adaptability, Communication, Critical thinking, Good communication skills,
379, Employee 379, Java, HTML, Azure, HTML, AWS, Leadership, Adaptability, Adaptability, Decision-making, Problem-solving, Needs to work on problem-solving skills,
380, Employee 380, Azure, Python, Azure, Java, AWS, Time management, Teamwork, Critical thinking, Adaptability, Time management, Needs to work on problem-solving skills,
381, Employee 381, SQL, HTML, SQL, CSS, JavaScript, Adaptability, Creativity, Conflict resolution, Adaptability, Problem-solving, Needs to work on problem-solving skills,
382, Employee 382, SQL, Docker, Python, HTML, Python, Problem-solving, Teamwork, Critical thinking, Teamwork, Teamwork, Excellent teamwork,
383, Employee 383, Azure, CSS, HTML, Azure, JavaScript, Leadership, Decision-making, Teamwork, Critical thinking, Creativity, Very creative,
384, Employee 384, AWS, Kubernetes, Docker, JavaScript, Kubernetes, Teamwork, Adaptability, Critical thinking, Communication, Creativity, Great work!,
385, Employee 385, Java, SQL, AWS, Kubernetes, AWS, Teamwork, Adaptability, Leadership, Critical thinking, Time management, Shows good decision-making skills,
386, Employee 386, SQL, Java, CSS, HTML, Java, Conflict resolution, Leadership, Creativity, Decision-making, Adaptability, Adapts well to changes,
387, Employee 387, Kubernetes, Azure, SQL, Azure, HTML, Decision-making, Adaptability, Problem-solving, Communication, Critical thinking, Needs to work on problem-solving skills,
388, Employee 388, JavaScript, Java, CSS, Docker, Python, Conflict resolution, Conflict resolution, Conflict resolution, Leadership, Communication, Adapts well to changes,
389, Employee 389, Azure, AWS, SQL, CSS, Java, Critical thinking, Decision-making, Teamwork, Problem-solving, Leadership, Excellent teamwork,
390, Employee 390, SQL, Java, CSS, Kubernetes, Kubernetes, Communication, Conflict resolution, Conflict resolution, Communication, Decision-making, Needs to improve attention to detail,
391, Employee 391, Kubernetes, Python, Java, AWS, Azure, Adaptability, Time management, Creativity, Teamwork, Leadership, Good communication skills,
392, Employee 392, Azure, Python, JavaScript, HTML, AWS, Decision-making, Teamwork, Teamwork, Time management, Teamwork, Good communication skills,
393, Employee 393, AWS, SQL, JavaScript, CSS, SQL, Problem-solving, Critical thinking, Time management, Decision-making, Time management, Shows good decision-making skills,
394, Employee 394, Docker, Python, Docker, Azure, AWS, Decision-making, Time management, Adaptability, Time management, Leadership, Great work!,
395, Employee 395, Python, Azure, Azure, SQL, Python, Teamwork, Leadership, Leadership, Leadership, Critical thinking, Adapts well to changes,
396, Employee 396, JavaScript, Docker, Python, Kubernetes, HTML, Adaptability, Leadership, Creativity, Leadership, Decision-making, Excellent teamwork,
397, Employee 397, Kubernetes, Azure, SQL, SQL, JavaScript, Critical thinking, Decision-making, Adaptability, Creativity, Leadership, Good communication skills,
398, Employee 398, AWS, SQL, Python, Azure, AWS, Creativity, Communication, Conflict resolution, Creativity, Communication, Adapts well to changes,
399, Employee 399, JavaScript, AWS, AWS, SQL, CSS, Teamwork, Adaptability, Conflict resolution, Adaptability, Problem-solving, Needs to work on problem-solving skills,
400, Employee 400, Kubernetes, CSS, SQL, SQL, Docker, Decision-making, Adaptability, Teamwork, Time management, Leadership, Very creative,
401, Employee 401, Docker, AWS, SQL, JavaScript, Azure, Leadership, Adaptability, Critical thinking, Problem-solving, Adaptability, Needs to work on problem-solving skills,
402, Employee 402, Docker, HTML, Python, CSS, Java, Time management, Creativity, Problem-solving, Time management, Communication, Excellent teamwork,
403, Employee 403, HTML, Kubernetes, Azure, JavaScript, Kubernetes, Creativity, Leadership, Time management, Communication, Creativity, Needs to improve attention to detail,
404, Employee 404, Docker, Java, Azure, CSS, Kubernetes, Critical thinking, Time management, Communication, Communication, Teamwork, Very creative,
405, Employee 405, Kubernetes, CSS, JavaScript, Java, Azure, Problem-solving, Leadership, Critical thinking, Creativity, Decision-making, Good communication skills,
406, Employee 406, JavaScript, JavaScript, Java, JavaScript, SQL, Time management, Decision-making, Creativity, Leadership, Creativity, Good communication skills,
407, Employee 407, Kubernetes, JavaScript, HTML, AWS, JavaScript, Time management, Decision-making, Time management, Communication, Teamwork, Shows good decision-making skills,
408, Employee 408, CSS, Python, HTML, Docker, JavaScript, Leadership, Time management, Teamwork, Communication, Decision-making, Very creative,
409, Employee 409, Docker, CSS, Python, Kubernetes, JavaScript, Problem-solving, Creativity, Creativity, Creativity, Creativity, Needs to work on problem-solving skills,
410, Employee 410, Kubernetes, HTML, SQL, Java, HTML, Time management, Decision-making, Time management, Decision-making, Leadership, Adapts well to changes,
411, Employee 411, Kubernetes, Docker, Azure, AWS, JavaScript, Critical thinking, Decision-making, Decision-making, Time management, Communication, Needs to improve attention to detail,
412, Employee 412, Azure, AWS, Java, CSS, SQL, Communication, Critical thinking, Time management, Decision-making, Teamwork, Adapts well to changes,
413, Employee 413, CSS, Python, HTML, Java, Azure, Creativity, Time management, Conflict resolution, Conflict resolution, Critical thinking, Adapts well to changes,
414, Employee 414, Java, SQL, HTML, SQL, Azure, Decision-making, Critical thinking, Creativity, Teamwork, Adaptability, Very creative,
415, Employee 415, Docker, JavaScript, Kubernetes, JavaScript, JavaScript, Decision-making, Adaptability, Creativity, Conflict resolution, Teamwork, Excellent teamwork,
416, Employee 416, Kubernetes, Docker, AWS, Python, HTML, Teamwork, Decision-making, Leadership, Problem-solving, Adaptability, Shows good decision-making skills,
417, Employee 417, SQL, Java, Python, AWS, SQL, Critical thinking, Teamwork, Teamwork, Problem-solving, Communication, Excellent teamwork,
418, Employee 418, Kubernetes, Java, Java, Docker, SQL, Problem-solving, Problem-solving, Communication, Teamwork, Conflict resolution, Adapts well to changes,
419, Employee 419, Docker, HTML, AWS, HTML, AWS, Conflict resolution, Teamwork, Creativity, Leadership, Creativity, Very creative,
420, Employee 420, CSS, Java, HTML, Kubernetes, JavaScript, Adaptability, Communication, Teamwork, Teamwork, Teamwork, Needs to improve attention to detail,
421, Employee 421, Java, JavaScript, Azure, Python, Python, Teamwork, Communication, Decision-making, Problem-solving, Conflict resolution, Great work!,
422, Employee 422, Docker, Python, SQL, Docker, AWS, Conflict resolution, Communication, Leadership, Critical thinking, Decision-making, Leadership potential,
423, Employee 423, AWS, CSS, CSS, Java, Python, Teamwork, Communication, Creativity, Critical thinking, Time management, Needs to improve attention to detail,
424, Employee 424, SQL, Java, Python, SQL, AWS, Leadership, Time management, Problem-solving, Communication, Conflict resolution, Shows good decision-making skills,
425, Employee 425, Python, Java, Java, Kubernetes, Kubernetes, Time management, Decision-making, Communication, Adaptability, Communication, Excellent teamwork,
426, Employee 426, HTML, Java, SQL, Python, JavaScript, Creativity, Creativity, Communication, Conflict resolution, Communication, Needs to work on problem-solving skills,
427, Employee 427, Docker, Azure, CSS, Python, JavaScript, Time management, Time management, Teamwork, Conflict resolution, Teamwork, Excellent teamwork,
428, Employee 428, JavaScript, Python, Python, Python, Azure, Critical thinking, Leadership, Communication, Problem-solving, Adaptability, Very creative,
429, Employee 429, SQL, Kubernetes, AWS, SQL, CSS, Leadership, Communication, Communication, Teamwork, Adaptability, Needs to improve attention to detail,
430, Employee 430, JavaScript, Azure, Kubernetes, Java, Azure, Teamwork, Creativity, Adaptability, Conflict resolution, Problem-solving, Needs to improve attention to detail,
431, Employee 431, HTML, Azure, Python, Docker, Kubernetes, Problem-solving, Creativity, Communication, Critical thinking, Teamwork, Adapts well to changes,
432, Employee 432, Kubernetes, AWS, JavaScript, HTML, SQL, Communication, Decision-making, Conflict resolution, Decision-making, Decision-making, Needs to work on problem-solving skills,
433, Employee 433, Kubernetes, AWS, Python, Java, Kubernetes, Critical thinking, Teamwork, Critical thinking, Leadership, Decision-making, Excellent teamwork,
434, Employee 434, Azure, Python, Docker, Docker, Java, Problem-solving, Conflict resolution, Adaptability, Leadership, Problem-solving, Needs improvement in time management,
435, Employee 435, AWS, Azure, Java, HTML, Azure, Creativity, Decision-making, Critical thinking, Problem-solving, Problem-solving, Great work!,
436, Employee 436, Azure, JavaScript, AWS, SQL, JavaScript, Leadership, Creativity, Time management, Time management, Decision-making, Shows good decision-making skills,
437, Employee 437, Java, Python, Java, Kubernetes, Docker, Adaptability, Critical thinking, Decision-making, Problem-solving, Teamwork, Needs improvement in time management,
438, Employee 438, Python, AWS, SQL, HTML, HTML, Leadership, Problem-solving, Teamwork, Time management, Decision-making, Needs to work on problem-solving skills,
439, Employee 439, AWS, JavaScript, Python, CSS, AWS, Time management, Communication, Conflict resolution, Creativity, Decision-making, Good communication skills,
440, Employee 440, Azure, Azure, SQL, AWS, Java, Communication, Time management, Communication, Critical thinking, Adaptability, Needs to improve attention to detail,
441, Employee 441, JavaScript, HTML, Kubernetes, SQL, JavaScript, Problem-solving, Adaptability, Problem-solving, Critical thinking, Teamwork, Needs to work on problem-solving skills,
442, Employee 442, Docker, HTML, SQL, Python, CSS, Communication, Creativity, Time management, Decision-making, Teamwork, Needs to work on problem-solving skills,
443, Employee 443, CSS, HTML, Docker, HTML, JavaScript, Problem-solving, Decision-making, Critical thinking, Time management, Problem-solving, Excellent teamwork,
444, Employee 444, CSS, Java, Python, Kubernetes, JavaScript, Problem-solving, Teamwork, Critical thinking, Decision-making, Adaptability, Leadership potential,
445, Employee 445, JavaScript, CSS, Kubernetes, Azure, SQL, Decision-making, Creativity, Time management, Critical thinking, Conflict resolution, Great work!,
446, Employee 446, HTML, CSS, Azure, JavaScript, Java, Teamwork, Teamwork, Time management, Time management, Teamwork, Leadership potential,
447, Employee 447, Kubernetes, Python, Kubernetes, Python, Java, Conflict resolution, Leadership, Leadership, Decision-making, Problem-solving, Shows good decision-making skills,
448, Employee 448, JavaScript, Python, Docker, AWS, HTML, Problem-solving, Communication, Communication, Time management, Creativity, Very creative,
449, Employee 449, Kubernetes, JavaScript, AWS, SQL, Docker, Leadership, Leadership, Time management, Critical thinking, Communication, Shows good decision-making skills,
450, Employee 450, CSS, Docker, SQL, Azure, CSS, Leadership, Leadership, Decision-making, Time management, Leadership, Leadership potential,
451, Employee 451, AWS, Java, JavaScript, Docker, Java, Decision-making, Creativity, Leadership, Problem-solving, Problem-solving, Very creative,
452, Employee 452, Java, Java, JavaScript, SQL, Azure, Adaptability, Adaptability, Decision-making, Conflict resolution, Critical thinking, Good communication skills,
453, Employee 453, Azure, Python, JavaScript, Python, JavaScript, Communication, Adaptability, Time management, Creativity, Problem-solving, Great work!,
454, Employee 454, Kubernetes, CSS, JavaScript, Java, Docker, Adaptability, Conflict resolution, Adaptability, Adaptability, Adaptability, Good communication skills,
455, Employee 455, CSS, AWS, AWS, Docker, Python, Time management, Problem-solving, Critical thinking, Problem-solving, Teamwork, Shows good decision-making skills,
456, Employee 456, Python, CSS, Java, JavaScript, SQL, Conflict resolution, Critical thinking, Communication, Time management, Adaptability, Needs improvement in time management,
457, Employee 457, Java, Azure, Python, Kubernetes, Docker, Decision-making, Creativity, Problem-solving, Communication, Time management, Good communication skills,
458, Employee 458, Java, Docker, AWS, HTML, CSS, Leadership, Adaptability, Adaptability, Communication, Teamwork, Great work!,
459, Employee 459, AWS, HTML, Docker, Python, JavaScript, Decision-making, Teamwork, Creativity, Decision-making, Communication, Excellent teamwork,
460, Employee 460, CSS, CSS, Docker, SQL, AWS, Decision-making, Time management, Teamwork, Teamwork, Time management, Needs to improve attention to detail,
461, Employee 461, HTML, CSS, Java, Kubernetes, Python, Communication, Problem-solving, Teamwork, Problem-solving, Communication, Leadership potential,
462, Employee 462, SQL, Kubernetes, Azure, SQL, CSS, Communication, Problem-solving, Critical thinking, Creativity, Teamwork, Great work!,
463, Employee 463, SQL, AWS, Kubernetes, AWS, AWS, Teamwork, Leadership, Critical thinking, Communication, Conflict resolution, Great work!,
464, Employee 464, CSS, AWS, Python, Java, CSS, Decision-making, Problem-solving, Conflict resolution, Adaptability, Time management, Good communication skills,
465, Employee 465, AWS, Kubernetes, Azure, SQL, HTML, Teamwork, Leadership, Problem-solving, Leadership, Time management, Great work!,
466, Employee 466, CSS, Kubernetes, Java, Python, AWS, Problem-solving, Leadership, Critical thinking, Critical thinking, Decision-making, Excellent teamwork,
467, Employee 467, HTML, Kubernetes, SQL, Kubernetes, Kubernetes, Communication, Adaptability, Conflict resolution, Decision-making, Conflict resolution, Leadership potential,
468, Employee 468, CSS, AWS, SQL, Azure, Docker, Leadership, Creativity, Problem-solving, Conflict resolution, Adaptability, Adapts well to changes,
469, Employee 469, Kubernetes, Azure, SQL, Java, Java, Decision-making, Creativity, Adaptability, Problem-solving, Decision-making, Great work!,
470, Employee 470, Docker, HTML, Java, SQL, CSS, Time management, Critical thinking, Conflict resolution, Leadership, Critical thinking, Needs to improve attention to detail,
471, Employee 471, JavaScript, HTML, HTML, CSS, Java, Adaptability, Time management, Problem-solving, Adaptability, Leadership, Leadership potential,
472, Employee 472, Kubernetes, Docker, Docker, Python, Docker, Creativity, Conflict resolution, Teamwork, Problem-solving, Time management, Needs to work on problem-solving skills,
473, Employee 473, Java, Python, Kubernetes, Python, HTML, Creativity, Conflict resolution, Leadership, Adaptability, Leadership, Leadership potential,
474, Employee 474, Java, Kubernetes, Python, SQL, AWS, Creativity, Leadership, Time management, Critical thinking, Conflict resolution, Good communication skills,
475, Employee 475, CSS, CSS, Java, AWS, Azure, Critical thinking, Time management, Problem-solving, Critical thinking, Creativity, Great work!,
476, Employee 476, Azure, JavaScript, SQL, CSS, Python, Creativity, Creativity, Creativity, Teamwork, Leadership, Needs to work on problem-solving skills,
477, Employee 477, HTML, Kubernetes, Kubernetes, Azure, SQL, Decision-making, Problem-solving, Time management, Time management, Adaptability, Leadership potential,
478, Employee 478, Java, Kubernetes, Kubernetes, Azure, JavaScript, Conflict resolution, Adaptability, Decision-making, Creativity, Critical thinking, Excellent teamwork,
479, Employee 479, Azure, Java, CSS, Python, Python, Critical thinking, Conflict resolution, Adaptability, Conflict resolution, Creativity, Needs improvement in time management,
480, Employee 480, Azure, Python, Java, CSS, JavaScript, Communication, Critical thinking, Communication, Communication, Communication, Good communication skills,
481, Employee 481, CSS, CSS, JavaScript, SQL, JavaScript, Creativity, Teamwork, Decision-making, Teamwork, Leadership, Excellent teamwork,
482, Employee 482, Azure, SQL, Docker, HTML, AWS, Leadership, Leadership, Problem-solving, Teamwork, Leadership, Shows good decision-making skills,
483, Employee 483, Docker, SQL, CSS, Java, SQL, Time management, Conflict resolution, Creativity, Decision-making, Conflict resolution, Needs improvement in time management,
