645, Employee 645, JavaScript, AWS, Python, JavaScript, Kubernetes, Time management, Adaptability, Time management, Leadership, Decision-making, Needs to work on problem-solving skills,
646, Employee 646, HTML, JavaScript, CSS, HTML, CSS, Teamwork, Conflict resolution, Adaptability, Conflict resolution, Decision-making, Great work!,
647, Employee 647, AWS, Docker, Kubernetes, HTML, Azure, Communication, Communication, Conflict resolution, Communication, Decision-making, Great work!,
648, Employee 648, Kubernetes, Python, Kubernetes, AWS, Kubernetes, Decision-making, Leadership, Conflict resolution, Decision-making, Problem-solving, Leadership potential,
649, Employee 649, HTML, HTML, SQL, SQL, CSS, Time management, Creativity, Adaptability, Leadership, Communication, Great work!,
650, Employee 650, Docker, Python, CSS, CSS, Docker, Time management, Communication, Critical thinking, Conflict resolution, Problem-solving, Needs improvement in time management,
651, Employee 651, Kubernetes, JavaScript, Java, Java, Kubernetes, Critical thinking, Problem-solving, Problem-solving, Critical thinking, Critical thinking, Great work!,
652, Employee 652, JavaScript, Azure, SQL, Kubernetes, Docker, Communication, Conflict resolution, Teamwork, Communication, Creativity, Shows good decision-making skills,
653, Employee 653, HTML, JavaScript, CSS, SQL, CSS, Problem-solving, Time management, Conflict resolution, Communication, Creativity, Adapts well to changes,
654, Employee 654, CSS, Azure, Azure, Docker, AWS, Adaptability, Adaptability, Leadership, Adaptability, Creativity, Good communication skills,
655, Employee 655, JavaScript, Java, SQL, SQL, SQL, Decision-making, Decision-making, Teamwork, Adaptability, Problem-solving, Shows good decision-making skills,
656, Employee 656, HTML, AWS, Java, SQL, SQL, Conflict resolution, Conflict resolution, Creativity, Leadership, Time management, Very creative,
657, Employee 657, Azure, HTML, Java, Java, Azure, Critical thinking, Problem-solving, Decision-making, Time management, Problem-solving, Shows good decision-making skills,
658, Employee 658, AWS, HTML, Azure, Java, Azure, Adaptability, Teamwork, Creativity, Time management, Teamwork, Great work!,
659, Employee 659, Kubernetes, SQL, Docker, Kubernetes, AWS, Time management, Conflict resolution, Decision-making, Critical thinking, Adaptability, Needs to improve attention to detail,
660, Employee 660, Docker, HTML, Docker, Kubernetes, HTML, Problem-solving, Critical thinking, Teamwork, Time management, Time management, Needs to work on problem-solving skills,
661, Employee 661, Kubernetes, SQL, Kubernetes, AWS, Java, Conflict resolution, Time management, Creativity, Critical thinking, Communication, Excellent teamwork,
662, Employee 662, CSS, Python, Azure, HTML, CSS, Conflict resolution, Teamwork, Communication, Communication, Adaptability, Excellent teamwork,
663, Employee 663, Azure, Azure, JavaScript, JavaScript, Docker, Creativity, Leadership, Problem-solving, Leadership, Time management, Needs to improve attention to detail,
664, Employee 664, AWS, JavaScript, Python, Azure, Kubernetes, Teamwork, Problem-solving, Conflict resolution, Decision-making, Problem-solving, Good communication skills,
665, Employee 665, Python, SQL, CSS, Java, CSS, Decision-making, Time management, Creativity, Critical thinking, Critical thinking, Very creative,
666, Employee 666, Kubernetes, JavaScript, Azure, Python, Docker, Problem-solving, Decision-making, Adaptability, Decision-making, Leadership, Adapts well to changes,
667, Employee 667, HTML, Kubernetes, Python, SQL, SQL, Decision-making, Decision-making, Creativity, Creativity, Conflict resolution, Shows good decision-making skills,
668, Employee 668, Java, Azure, CSS, JavaScript, HTML, Conflict resolution, Leadership, Creativity, Conflict resolution, Teamwork, Adapts well to changes,
669, Employee 669, SQL, SQL, CSS, JavaScript, Docker, Problem-solving, Communication, Creativity, Conflict resolution, Communication, Needs to improve attention to detail,
670, Employee 670, Kubernetes, AWS, CSS, SQL, JavaScript, Leadership, Teamwork, Time management, Adaptability, Conflict resolution, Needs improvement in time management,
671, Employee 671, AWS, CSS, SQL, CSS, Azure, Problem-solving, Problem-solving, Critical thinking, Time management, Problem-solving, Needs to improve attention to detail,
672, Employee 672, SQL, CSS, HTML, HTML, SQL, Teamwork, Problem-solving, Conflict resolution, Communication, Communication, Leadership potential,
673, Employee 673, AWS, Python, JavaScript, Python, SQL, Critical thinking, Leadership, Communication, Decision-making, Creativity, Needs to improve attention to detail,
674, Employee 674, SQL, Azure, CSS, Python, Python, Time management, Critical thinking, Conflict resolution, Teamwork, Leadership, Needs improvement in time management,
675, Employee 675, Kubernetes, AWS, Kubernetes, Docker, CSS, Problem-solving, Decision-making, Adaptability, Creativity, Critical thinking, Adapts well to changes,
676, Employee 676, Java, Kubernetes, CSS, Kubernetes, CSS, Communication, Creativity, Conflict resolution, Critical thinking, Leadership, Needs to improve attention to detail,
677, Employee 677, Kubernetes, Docker, Java, JavaScript, AWS, Creativity, Creativity, Leadership, Time management, Time management, Good communication skills,
678, Employee 678, Java, JavaScript, SQL, SQL, Java, Problem-solving, Leadership, Conflict resolution, Time management, Creativity, Needs improvement in time management,
679, Employee 679, Azure, HTML, Azure, HTML, Python, Communication, Decision-making, Time management, Critical thinking, Problem-solving, Very creative,
680, Employee 680, JavaScript, Python, Python, Java, Kubernetes, Decision-making, Adaptability, Leadership, Critical thinking, Adaptability, Needs to improve attention to detail,
681, Employee 681, CSS, HTML, Kubernetes, JavaScript, Docker, Communication, Teamwork, Decision-making, Critical thinking, Critical thinking, Very creative,
682, Employee 682, Java, Python, Azure, Docker, JavaScript, Time management, Conflict resolution, Adaptability, Creativity, Time management, Needs to work on problem-solving skills,
683, Employee 683, Azure, Docker, Kubernetes, JavaScript, Kubernetes, Conflict resolution, Decision-making, Teamwork, Critical thinking, Critical thinking, Leadership potential,
684, Employee 684, JavaScript, SQL, HTML, Azure, AWS, Creativity, Time management, Adaptability, Decision-making, Communication, Needs to improve attention to detail,
685, Employee 685, SQL, Docker, Python, Docker, AWS, Decision-making, Decision-making, Conflict resolution, Problem-solving, Critical thinking, Needs improvement in time management,
686, Employee 686, Azure, Kubernetes, Java, CSS, AWS, Communication, Time management, Teamwork, Decision-making, Adaptability, Great work!,
687, Employee 687, AWS, AWS, HTML, Azure, Java, Critical thinking, Critical thinking, Creativity, Problem-solving, Creativity, Needs improvement in time management,
688, Employee 688, CSS, HTML, AWS, Java, Java, Leadership, Creativity, Problem-solving, Teamwork, Time management, Very creative,
689, Employee 689, AWS, JavaScript, HTML, CSS, Kubernetes, Adaptability, Critical thinking, Decision-making, Critical thinking, Decision-making, Needs improvement in time management,
690, Employee 690, Docker, Docker, CSS, CSS, JavaScript, Conflict resolution, Adaptability, Problem-solving, Problem-solving, Problem-solving, Excellent teamwork,
691, Employee 691, SQL, Python, CSS, Python, Java, Teamwork, Critical thinking, Time management, Creativity, Adaptability, Very creative,
692, Employee 692, CSS, CSS, HTML, Docker, CSS, Conflict resolution, Adaptability, Adaptability, Decision-making, Time management, Leadership potential,
693, Employee 693, AWS, SQL, CSS, Azure, AWS, Problem-solving, Adaptability, Adaptability, Leadership, Teamwork, Great work!,
694, Employee 694, Python, AWS, SQL, Azure, Azure, Critical thinking, Adaptability, Teamwork, Adaptability, Time management, Needs to work on problem-solving skills,
695, Employee 695, SQL, Kubernetes, Docker, SQL, AWS, Critical thinking, Critical thinking, Decision-making, Teamwork, Decision-making, Very creative,
696, Employee 696, AWS, Java, JavaScript, CSS, HTML, Conflict resolution, Communication, Decision-making, Adaptability, Decision-making, Adapts well to changes,
697, Employee 697, Java, JavaScript, JavaScript, Java, Azure, Decision-making, Decision-making, Time management, Critical thinking, Decision-making, Adapts well to changes,
698, Employee 698, Python, Azure, AWS, Azure, Python, Decision-making, Adaptability, Teamwork, Decision-making, Decision-making, Needs improvement in time management,
699, Employee 699, Docker, HTML, HTML, Azure, Python, Decision-making, Teamwork, Communication, Problem-solving, Adaptability, Needs to improve attention to detail,
700, Employee 700, CSS, Python, Kubernetes, Java, Kubernetes, Conflict resolution, Creativity, Adaptability, Creativity, Adaptability, Good communication skills,
701, Employee 701, Python, SQL, AWS, Java, Azure, Teamwork, Conflict resolution, Communication, Leadership, Decision-making, Needs to work on problem-solving skills,
702, Employee 702, Python, HTML, CSS, JavaScript, AWS, Decision-making, Communication, Teamwork, Time management, Problem-solving, Needs improvement in time management,
703, Employee 703, HTML, JavaScript, Azure, Azure, Java, Conflict resolution, Critical thinking, Critical thinking, Communication, Communication, Leadership potential,
704, Employee 704, Azure, AWS, Kubernetes, Python, SQL, Decision-making, Teamwork, Teamwork, Leadership, Creativity, Great work!,
705, Employee 705, AWS, JavaScript, AWS, JavaScript, JavaScript, Decision-making, Critical thinking, Conflict resolution, Communication, Problem-solving, Needs improvement in time management,
706, Employee 706, CSS, Java, Java, Kubernetes, CSS, Adaptability, Creativity, Adaptability, Critical thinking, Conflict resolution, Adapts well to changes,
707, Employee 707, HTML, Java, Kubernetes, Python, Kubernetes, Critical thinking, Adaptability, Leadership, Creativity, Decision-making, Needs to improve attention to detail,
708, Employee 708, HTML, Kubernetes, JavaScript, Azure, HTML, Teamwork, Creativity, Critical thinking, Conflict resolution, Decision-making, Good communication skills,
709, Employee 709, Python, Python, CSS, HTML, AWS, Adaptability, Communication, Leadership, Problem-solving, Time management, Excellent teamwork,
710, Employee 710, Docker, CSS, SQL, Docker, Azure, Conflict resolution, Communication, Creativity, Teamwork, Time management, Excellent teamwork,
711, Employee 711, AWS, Kubernetes, CSS, SQL, Azure, Critical thinking, Time management, Problem-solving, Communication, Problem-solving, Adapts well to changes,
712, Employee 712, Docker, Python, Python, Docker, Azure, Conflict resolution, Leadership, Critical thinking, Teamwork, Leadership, Great work!,
713, Employee 713, Docker, SQL, HTML, Java, SQL, Critical thinking, Teamwork, Time management, Leadership, Time management, Needs to improve attention to detail,
714, Employee 714, Docker, HTML, Java, Python, SQL, Teamwork, Critical thinking, Adaptability, Leadership, Critical thinking, Great work!,
715, Employee 715, Docker, JavaScript, HTML, Python, Docker, Problem-solving, Teamwork, Leadership, Teamwork, Time management, Needs to work on problem-solving skills,
716, Employee 716, SQL, CSS, JavaScript, AWS, Python, Critical thinking, Time management, Time management, Teamwork, Decision-making, Leadership potential,
717, Employee 717, Java, Python, SQL, AWS, Python, Teamwork, Conflict resolution, Leadership, Decision-making, Time management, Good communication skills,
718, Employee 718, Kubernetes, Python, Java, HTML, HTML, Time management, Teamwork, Time management, Time management, Creativity, Needs to work on problem-solving skills,
719, Employee 719, HTML, HTML, JavaScript, Python, AWS, Communication, Communication, Time management, Decision-making, Adaptability, Needs to work on problem-solving skills,
720, Employee 720, Java, Kubernetes, Python, Kubernetes, Kubernetes, Problem-solving, Adaptability, Critical thinking, Conflict resolution, Time management, Good communication skills,
721, Employee 721, CSS, SQL, Azure, Docker, CSS, Decision-making, Communication, Communication, Communication, Leadership, Very creative,
722, Employee 722, HTML, Azure, Kubernetes, AWS, SQL, Communication, Conflict resolution, Decision-making, Adaptability, Time management, Needs to work on problem-solving skills,
723, Employee 723, HTML, CSS, SQL, Azure, JavaScript, Time management, Teamwork, Teamwork, Problem-solving, Decision-making, Good communication skills,
724, Employee 724, Java, Kubernetes, HTML, Kubernetes, HTML, Communication, Leadership, Leadership, Time management, Adaptability, Adapts well to changes,
725, Employee 725, Azure, HTML, Kubernetes, CSS, HTML, Teamwork, Problem-solving, Time management, Leadership, Adaptability, Leadership potential,
726, Employee 726, Kubernetes, Azure, CSS, JavaScript, Azure, Critical thinking, Critical thinking, Teamwork, Time management, Adaptability, Needs to improve attention to detail,
727, Employee 727, Java, HTML, Docker, SQL, JavaScript, Time management, Teamwork, Leadership, Adaptability, Communication, Very creative,
728, Employee 728, JavaScript, Python, HTML, CSS, SQL, Time management, Critical thinking, Decision-making, Critical thinking, Teamwork, Great work!,
729, Employee 729, Azure, Python, Azure, JavaScript, Java, Teamwork, Critical thinking, Decision-making, Decision-making, Critical thinking, Adapts well to changes,
730, Employee 730, Kubernetes, SQL, Java, Azure, CSS, Creativity, Decision-making, Creativity, Adaptability, Decision-making, Shows good decision-making skills,
731, Employee 731, CSS, Python, SQL, Kubernetes, JavaScript, Adaptability, Decision-making, Adaptability, Time management, Creativity, Excellent teamwork,
732, Employee 732, Docker, CSS, Java, Python, AWS, Leadership, Adaptability, Critical thinking, Adaptability, Adaptability, Excellent teamwork,
733, Employee 733, Kubernetes, HTML, Java, HTML, Python, Critical thinking, Adaptability, Decision-making, Communication, Adaptability, Good communication skills,
734, Employee 734, Docker, SQL, SQL, JavaScript, JavaScript, Critical thinking, Conflict resolution, Problem-solving, Problem-solving, Problem-solving, Very creative,
735, Employee 735, Python, Python, Kubernetes, CSS, Docker, Time management, Conflict resolution, Decision-making, Teamwork, Adaptability, Excellent teamwork,
736, Employee 736, HTML, AWS, HTML, HTML, Docker, Decision-making, Decision-making, Leadership, Communication, Creativity, Excellent teamwork,
737, Employee 737, AWS, HTML, Kubernetes, CSS, AWS, Decision-making, Creativity, Communication, Decision-making, Conflict resolution, Needs to work on problem-solving skills,
738, Employee 738, Azure, Docker, Java, HTML, AWS, Conflict resolution, Leadership, Adaptability, Conflict resolution, Teamwork, Adapts well to changes,
739, Employee 739, Kubernetes, HTML, Java, Java, CSS, Decision-making, Critical thinking, Creativity, Critical thinking, Conflict resolution, Needs to work on problem-solving skills,
740, Employee 740, Docker, Docker, Python, Kubernetes, CSS, Creativity, Time management, Problem-solving, Problem-solving, Leadership, Great work!,
741, Employee 741, SQL, Kubernetes, Python, SQL, Azure, Decision-making, Leadership, Problem-solving, Leadership, Adaptability, Shows good decision-making skills,
742, Employee 742, HTML, Python, Python, HTML, CSS, Time management, Time management, Creativity, Teamwork, Adaptability, Leadership potential,
743, Employee 743, Docker, JavaScript, JavaScript, AWS, JavaScript, Teamwork, Critical thinking, Leadership, Leadership, Creativity, Needs to improve attention to detail,
744, Employee 744, AWS, JavaScript, Kubernetes, HTML, Docker, Adaptability, Creativity, Leadership, Creativity, Teamwork, Needs to improve attention to detail,
745, Employee 745, HTML, Azure, JavaScript, Docker, Python, Creativity, Leadership, Leadership, Time management, Decision-making, Shows good decision-making skills,
746, Employee 746, AWS, Java, JavaScript, JavaScript, HTML, Communication, Decision-making, Conflict resolution, Problem-solving, Problem-solving, Needs to improve attention to detail,
747, Employee 747, AWS, Docker, Docker, Azure, Kubernetes, Teamwork, Teamwork, Creativity, Communication, Leadership, Adapts well to changes,
748, Employee 748, JavaScript, Java, CSS, Java, SQL, Critical thinking, Conflict resolution, Decision-making, Adaptability, Conflict resolution, Shows good decision-making skills,
749, Employee 749, SQL, JavaScript, Docker, HTML, CSS, Creativity, Time management, Communication, Creativity, Teamwork, Adapts well to changes,
750, Employee 750, SQL, Docker, Java, Azure, Kubernetes, Decision-making, Critical thinking, Decision-making, Time management, Communication, Shows good decision-making skills,
751, Employee 751, AWS, CSS, HTML, Docker, Python, Communication, Time management, Time management, Communication, Conflict resolution, Needs improvement in time management,
752, Employee 752, Kubernetes, AWS, Kubernetes, Kubernetes, Docker, Creativity, Decision-making, Adaptability, Communication, Conflict resolution, Needs to work on problem-solving skills,
753, Employee 753, Python, AWS, JavaScript, AWS, SQL, Creativity, Creativity, Decision-making, Time management, Leadership, Good communication skills,
754, Employee 754, AWS, AWS, HTML, JavaScript, SQL, Decision-making, Leadership, Conflict resolution, Communication, Critical thinking, Shows good decision-making skills,
755, Employee 755, Kubernetes, AWS, Java, Java, AWS, Time management, Decision-making, Time management, Communication, Leadership, Shows good decision-making skills,
756, Employee 756, HTML, Python, AWS, SQL, Java, Problem-solving, Critical thinking, Leadership, Communication, Critical thinking, Leadership potential,
757, Employee 757, JavaScript, Kubernetes, Java, HTML, HTML, Adaptability, Teamwork, Time management, Adaptability, Communication, Leadership potential,
758, Employee 758, Python, Kubernetes, CSS, Java, Kubernetes, Problem-solving, Communication, Adaptability, Problem-solving, Adaptability, Needs to work on problem-solving skills,
759, Employee 759, SQL, AWS, CSS, JavaScript, AWS, Adaptability, Conflict resolution, Decision-making, Problem-solving, Decision-making, Shows good decision-making skills,
760, Employee 760, Python, AWS, CSS, Azure, HTML, Adaptability, Problem-solving, Time management, Critical thinking, Critical thinking, Needs improvement in time management,
761, Employee 761, SQL, CSS, Python, JavaScript, JavaScript, Decision-making, Teamwork, Adaptability, Teamwork, Problem-solving, Excellent teamwork,
762, Employee 762, Kubernetes, Python, CSS, Java, Java, Adaptability, Communication, Critical thinking, Problem-solving, Critical thinking, Needs improvement in time management,
763, Employee 763, Java, AWS, Kubernetes, Docker, AWS, Time management, Leadership, Decision-making, Adaptability, Problem-solving, Great work!,
764, Employee 764, Kubernetes, Docker, AWS, HTML, HTML, Conflict resolution, Critical thinking, Decision-making, Problem-solving, Decision-making, Good communication skills,
765, Employee 765, HTML, CSS, SQL, HTML, Python, Time management, Creativity, Adaptability, Adaptability, Time management, Good communication skills,
766, Employee 766, AWS, Python, Python, Azure, Docker, Leadership, Leadership, Problem-solving, Problem-solving, Problem-solving, Needs improvement in time management,
767, Employee 767, Python, Java, Azure, JavaScript, AWS, Adaptability, Communication, Adaptability, Communication, Problem-solving, Needs to improve attention to detail,
768, Employee 768, Java, AWS, CSS, Kubernetes, SQL, Adaptability, Conflict resolution, Problem-solving, Creativity, Creativity, Leadership potential,
769, Employee 769, JavaScript, Kubernetes, AWS, Azure, CSS, Communication, Critical thinking, Decision-making, Time management, Problem-solving, Excellent teamwork,
770, Employee 770, AWS, JavaScript, CSS, CSS, AWS, Adaptability, Decision-making, Communication, Creativity, Communication, Very creative,
771, Employee 771, Azure, Azure, Java, Java, JavaScript, Problem-solving, Leadership, Adaptability, Conflict resolution, Creativity, Excellent teamwork,
772, Employee 772, AWS, Docker, JavaScript, Azure, JavaScript, Decision-making, Creativity, Adaptability, Critical thinking, Creativity, Great work!,
773, Employee 773, Python, Kubernetes, CSS, JavaScript, Azure, Conflict resolution, Adaptability, Creativity, Critical thinking, Decision-making, Excellent teamwork,
774, Employee 774, AWS, Python, Kubernetes, Azure, SQL, Problem-solving, Adaptability, Teamwork, Conflict resolution, Critical thinking, Needs improvement in time management,
775, Employee 775, Kubernetes, Azure, Python, JavaScript, Java, Teamwork, Critical thinking, Time management, Problem-solving, Decision-making, Good communication skills,
776, Employee 776, Kubernetes, HTML, CSS, JavaScript, Python, Communication, Creativity, Problem-solving, Teamwork, Creativity, Needs to work on problem-solving skills,
777, Employee 777, SQL, Python, HTML, SQL, JavaScript, Conflict resolution, Decision-making, Adaptability, Creativity, Decision-making, Adapts well to changes,
778, Employee 778, CSS, Kubernetes, Azure, Kubernetes, Python, Problem-solving, Time management, Communication, Teamwork, Teamwork, Leadership potential,
779, Employee 779, Docker, AWS, Java, Python, HTML, Creativity, Creativity, Problem-solving, Teamwork, Leadership, Needs to improve attention to detail,
780, Employee 780, Java, CSS, Python, SQL, Docker, Teamwork, Problem-solving, Critical thinking, Time management, Time management, Needs to improve attention to detail,
781, Employee 781, AWS, CSS, CSS, CSS, Python, Creativity, Time management, Problem-solving, Conflict resolution, Critical thinking, Leadership potential,
782, Employee 782, SQL, JavaScript, Java, HTML, JavaScript, Conflict resolution, Communication, Critical thinking, Decision-making, Time management, Shows good decision-making skills,
783, Employee 783, Azure, CSS, SQL, Docker, AWS, Leadership, Leadership, Problem-solving, Problem-solving, Time management, Very creative,
784, Employee 784, Java, CSS, JavaScript, Docker, Java, Critical thinking, Critical thinking, Leadership, Decision-making, Creativity, Needs improvement in time management,
785, Employee 785, Kubernetes, Docker, Azure, JavaScript, HTML, Adaptability, Leadership, Problem-solving, Adaptability, Time management, Needs to work on problem-solving skills,
786, Employee 786, CSS, Docker, HTML, HTML, AWS, Critical thinking, Leadership, Conflict resolution, Conflict resolution, Decision-making, Leadership potential,
787, Employee 787, AWS, CSS, Docker, JavaScript, Docker, Leadership, Problem-solving, Adaptability, Problem-solving, Conflict resolution, Great work!,
788, Employee 788, Java, HTML, Azure, Azure, Python, Problem-solving, Critical thinking, Leadership, Time management, Adaptability, Very creative,
789, Employee 789, AWS, Python, HTML, JavaScript, SQL, Creativity, Critical thinking, Communication, Critical thinking, Teamwork, Needs to work on problem-solving skills,
790, Employee 790, Python, HTML, Docker, AWS, Python, Decision-making, Creativity, Teamwork, Conflict resolution, Creativity, Adapts well to changes,
791, Employee 791, JavaScript, Kubernetes, Kubernetes, SQL, Python, Creativity, Leadership, Time management, Communication, Teamwork, Adapts well to changes,
792, Employee 792, Azure, Kubernetes, Azure, HTML, Docker, Creativity, Time management, Decision-making, Communication, Teamwork, Needs improvement in time management,
793, Employee 793, Azure, SQL, Java, Java, Kubernetes, Teamwork, Critical thinking, Creativity, Problem-solving, Decision-making, Needs improvement in time management,
794, Employee 794, AWS, AWS, Azure, Kubernetes, Docker, Decision-making, Time management, Leadership, Time management, Creativity, Needs to improve attention to detail,
795, Employee 795, Docker, SQL, Docker, JavaScript, Python, Creativity, Conflict resolution, Time management, Conflict resolution, Conflict resolution, Needs to improve attention to detail,
796, Employee 796, Azure, AWS, Kubernetes, CSS, Docker, Teamwork, Adaptability, Time management, Leadership, Time management, Needs improvement in time management,
797, Employee 797, JavaScript, CSS, Kubernetes, SQL, HTML, Adaptability, Critical thinking, Leadership, Adaptability, Critical thinking, Good communication skills,
798, Employee 798, AWS, HTML, SQL, Python, Java, Teamwork, Time management, Adaptability, Conflict resolution, Critical thinking, Good communication skills,
799, Employee 799, Azure, AWS, Azure, HTML, Azure, Teamwork, Adaptability, Time management, Conflict resolution, Leadership, Leadership potential,
800, Employee 800, JavaScript, AWS, Kubernetes, CSS, AWS, Adaptability, Problem-solving, Leadership, Leadership, Adaptability, Leadership potential,
801, Employee 801, Python, CSS, HTML, Kubernetes, AWS, Creativity, Teamwork, Communication, Time management, Leadership, Leadership potential,
802, Employee 802, CSS, Azure, HTML, CSS, HTML, Creativity, Leadership, Time management, Teamwork, Communication, Good communication skills,
803, Employee 803, Azure, CSS, JavaScript, CSS, AWS, Communication, Time management, Leadership, Decision-making, Time management, Very creative,
