484, Employee 484, SQL, SQL, Docker, Docker, SQL, Problem-solving, Problem-solving, Decision-making, Teamwork, Creativity, Needs improvement in time management,
485, Employee 485, JavaScript, Azure, Java, AWS, AWS, Creativity, Critical thinking, Creativity, Problem-solving, Leadership, Excellent teamwork,
486, Employee 486, Kubernetes, Kubernetes, Java, AWS, Docker, Critical thinking, Time management, Conflict resolution, Time management, Time management, Great work!,
487, Employee 487, Kubernetes, Azure, Java, Java, JavaScript, Critical thinking, Leadership, Adaptability, Creativity, Critical thinking, Great work!,
488, Employee 488, Kubernetes, Azure, SQL, HTML, CSS, Critical thinking, Decision-making, Critical thinking, Leadership, Time management, Excellent teamwork,
489, Employee 489, HTML, Python, AWS, Azure, Kubernetes, Creativity, Problem-solving, Teamwork, Time management, Time management, Shows good decision-making skills,
490, Employee 490, AWS, SQL, SQL, SQL, Java, Leadership, Creativity, Creativity, Time management, Decision-making, Shows good decision-making skills,
491, Employee 491, Java, SQL, Java, SQL, Azure, Time management, Critical thinking, Teamwork, Decision-making, Communication, Excellent teamwork,
492, Employee 492, AWS, Python, SQL, Azure, Java, Conflict resolution, Problem-solving, Leadership, Leadership, Problem-solving, Needs to work on problem-solving skills,
493, Employee 493, Azure, JavaScript, SQL, Python, Docker, Conflict resolution, Conflict resolution, Communication, Communication, Communication, Adapts well to changes,
494, Employee 494, SQL, CSS, Docker, Docker, Docker, Adaptability, Leadership, Leadership, Critical thinking, Teamwork, Great work!,
495, Employee 495, SQL, Python, CSS, Java, Kubernetes, Communication, Adaptability, Time management, Critical thinking, Creativity, Very creative,
496, Employee 496, JavaScript, Azure, Python, SQL, JavaScript, Creativity, Leadership, Adaptability, Decision-making, Time management, Very creative,
497, Employee 497, AWS, Docker, Kubernetes, SQL, Kubernetes, Problem-solving, Time management, Teamwork, Adaptability, Decision-making, Adapts well to changes,
498, Employee 498, Docker, Java, HTML, Docker, AWS, Decision-making, Critical thinking, Critical thinking, Creativity, Problem-solving, Very creative,
499, Employee 499, Docker, Docker, SQL, SQL, HTML, Critical thinking, Decision-making, Adaptability, Teamwork, Time management, Needs improvement in time management,
500, Employee 500, Docker, HTML, Python, Docker, Kubernetes, Problem-solving, Teamwork, Creativity, Time management, Creativity, Very creative,
501, Employee 501, Azure, Java, Docker, Docker, HTML, Conflict resolution, Teamwork, Time management, Leadership, Teamwork, Excellent teamwork,
502, Employee 502, JavaScript, Kubernetes, CSS, HTML, Azure, Conflict resolution, Communication, Communication, Creativity, Decision-making, Great work!,
503, Employee 503, SQL, SQL, CSS, Azure, SQL, Conflict resolution, Time management, Problem-solving, Teamwork, Conflict resolution, Needs to improve attention to detail,
504, Employee 504, HTML, Azure, SQL, Kubernetes, HTML, Adaptability, Leadership, Problem-solving, Communication, Critical thinking, Very creative,
505, Employee 505, Docker, Kubernetes, AWS, Docker, Docker, Leadership, Time management, Time management, Teamwork, Problem-solving, Very creative,
506, Employee 506, Docker, Docker, AWS, Docker, Azure, Conflict resolution, Leadership, Problem-solving, Time management, Adaptability, Adapts well to changes,
507, Employee 507, AWS, HTML, HTML, SQL, HTML, Leadership, Communication, Leadership, Time management, Leadership, Needs to work on problem-solving skills,
508, Employee 508, Python, Kubernetes, JavaScript, JavaScript, HTML, Teamwork, Conflict resolution, Decision-making, Conflict resolution, Leadership, Needs improvement in time management,
509, Employee 509, Java, Azure, HTML, Azure, Kubernetes, Problem-solving, Critical thinking, Problem-solving, Creativity, Teamwork, Excellent teamwork,
510, Employee 510, SQL, Kubernetes, CSS, SQL, Python, Adaptability, Creativity, Critical thinking, Communication, Communication, Good communication skills,
511, Employee 511, SQL, Python, CSS, Python, HTML, Leadership, Teamwork, Time management, Decision-making, Time management, Shows good decision-making skills,
512, Employee 512, CSS, Python, SQL, CSS, AWS, Problem-solving, Critical thinking, Creativity, Time management, Creativity, Needs to improve attention to detail,
513, Employee 513, CSS, Python, AWS, AWS, Kubernetes, Critical thinking, Critical thinking, Leadership, Decision-making, Conflict resolution, Needs to improve attention to detail,
514, Employee 514, Azure, CSS, AWS, Kubernetes, Kubernetes, Critical thinking, Creativity, Adaptability, Conflict resolution, Adaptability, Needs to work on problem-solving skills,
515, Employee 515, AWS, HTML, Kubernetes, Docker, Kubernetes, Teamwork, Critical thinking, Communication, Adaptability, Communication, Needs to improve attention to detail,
516, Employee 516, SQL, CSS, Java, Python, HTML, Decision-making, Communication, Teamwork, Time management, Communication, Needs improvement in time management,
517, Employee 517, JavaScript, AWS, Java, Azure, Python, Decision-making, Creativity, Leadership, Teamwork, Adaptability, Needs to work on problem-solving skills,
518, Employee 518, Azure, CSS, Docker, CSS, Python, Time management, Critical thinking, Creativity, Conflict resolution, Time management, Very creative,
519, Employee 519, SQL, HTML, JavaScript, JavaScript, JavaScript, Communication, Communication, Leadership, Creativity, Teamwork, Excellent teamwork,
520, Employee 520, HTML, Kubernetes, JavaScript, Docker, Azure, Adaptability, Critical thinking, Creativity, Conflict resolution, Conflict resolution, Very creative,
521, Employee 521, SQL, Docker, Docker, SQL, Python, Critical thinking, Critical thinking, Communication, Creativity, Problem-solving, Needs improvement in time management,
522, Employee 522, Python, Python, Kubernetes, SQL, Azure, Decision-making, Communication, Problem-solving, Creativity, Leadership, Adapts well to changes,
523, Employee 523, Docker, HTML, SQL, Java, Azure, Time management, Conflict resolution, Critical thinking, Communication, Decision-making, Adapts well to changes,
524, Employee 524, Azure, CSS, SQL, JavaScript, AWS, Decision-making, Critical thinking, Time management, Teamwork, Leadership, Needs improvement in time management,
525, Employee 525, AWS, JavaScript, JavaScript, Docker, Python, Adaptability, Adaptability, Time management, Leadership, Time management, Needs to improve attention to detail,
526, Employee 526, SQL, Docker, AWS, Azure, Python, Adaptability, Teamwork, Teamwork, Leadership, Leadership, Very creative,
527, Employee 527, HTML, Azure, SQL, Docker, SQL, Teamwork, Teamwork, Communication, Problem-solving, Leadership, Very creative,
528, Employee 528, Kubernetes, Azure, SQL, HTML, CSS, Decision-making, Time management, Creativity, Teamwork, Time management, Needs improvement in time management,
529, Employee 529, Docker, Azure, CSS, AWS, CSS, Communication, Time management, Creativity, Time management, Adaptability, Good communication skills,
530, Employee 530, AWS, JavaScript, Docker, JavaScript, JavaScript, Problem-solving, Adaptability, Decision-making, Leadership, Time management, Excellent teamwork,
531, Employee 531, Java, Python, Azure, Kubernetes, Java, Teamwork, Time management, Creativity, Communication, Adaptability, Very creative,
532, Employee 532, Docker, SQL, Azure, Java, AWS, Problem-solving, Critical thinking, Leadership, Problem-solving, Problem-solving, Very creative,
533, Employee 533, HTML, HTML, CSS, Azure, Kubernetes, Problem-solving, Decision-making, Decision-making, Decision-making, Problem-solving, Excellent teamwork,
534, Employee 534, Docker, JavaScript, JavaScript, Java, Python, Problem-solving, Time management, Teamwork, Communication, Adaptability, Needs improvement in time management,
535, Employee 535, HTML, HTML, Azure, Docker, Docker, Creativity, Leadership, Problem-solving, Decision-making, Creativity, Good communication skills,
536, Employee 536, Python, SQL, JavaScript, AWS, HTML, Problem-solving, Teamwork, Creativity, Teamwork, Creativity, Needs to improve attention to detail,
537, Employee 537, JavaScript, Java, JavaScript, Azure, Docker, Decision-making, Teamwork, Problem-solving, Problem-solving, Conflict resolution, Needs to improve attention to detail,
538, Employee 538, SQL, Python, Python, Docker, JavaScript, Teamwork, Communication, Leadership, Time management, Critical thinking, Excellent teamwork,
539, Employee 539, HTML, Azure, HTML, HTML, Kubernetes, Time management, Communication, Leadership, Communication, Leadership, Very creative,
540, Employee 540, CSS, Java, Azure, Docker, Python, Adaptability, Decision-making, Problem-solving, Conflict resolution, Creativity, Great work!,
541, Employee 541, JavaScript, Docker, Java, Kubernetes, AWS, Teamwork, Critical thinking, Critical thinking, Conflict resolution, Adaptability, Great work!,
542, Employee 542, CSS, Python, CSS, HTML, Kubernetes, Conflict resolution, Teamwork, Critical thinking, Leadership, Teamwork, Needs to improve attention to detail,
543, Employee 543, JavaScript, Kubernetes, Java, Azure, AWS, Critical thinking, Problem-solving, Adaptability, Adaptability, Problem-solving, Shows good decision-making skills,
544, Employee 544, HTML, JavaScript, HTML, AWS, HTML, Communication, Conflict resolution, Time management, Problem-solving, Decision-making, Great work!,
545, Employee 545, HTML, Docker, Docker, HTML, SQL, Decision-making, Communication, Leadership, Teamwork, Conflict resolution, Very creative,
546, Employee 546, Docker, Docker, CSS, Docker, JavaScript, Adaptability, Conflict resolution, Adaptability, Teamwork, Leadership, Very creative,
547, Employee 547, CSS, CSS, JavaScript, Docker, Docker, Problem-solving, Time management, Critical thinking, Time management, Problem-solving, Adapts well to changes,
548, Employee 548, HTML, Azure, Docker, HTML, Docker, Conflict resolution, Creativity, Critical thinking, Decision-making, Communication, Very creative,
549, Employee 549, AWS, Azure, SQL, Python, JavaScript, Time management, Time management, Critical thinking, Leadership, Adaptability, Excellent teamwork,
550, Employee 550, Azure, Kubernetes, Kubernetes, Kubernetes, CSS, Creativity, Time management, Conflict resolution, Adaptability, Critical thinking, Excellent teamwork,
551, Employee 551, HTML, Docker, SQL, Azure, HTML, Problem-solving, Teamwork, Adaptability, Communication, Problem-solving, Needs improvement in time management,
552, Employee 552, Kubernetes, Docker, HTML, Python, Python, Critical thinking, Adaptability, Teamwork, Adaptability, Decision-making, Needs to improve attention to detail,
553, Employee 553, Kubernetes, AWS, CSS, SQL, CSS, Creativity, Decision-making, Communication, Critical thinking, Decision-making, Needs improvement in time management,
554, Employee 554, Python, SQL, HTML, JavaScript, Kubernetes, Time management, Adaptability, Time management, Leadership, Teamwork, Shows good decision-making skills,
555, Employee 555, Docker, Python, Java, CSS, JavaScript, Adaptability, Creativity, Adaptability, Creativity, Decision-making, Very creative,
556, Employee 556, AWS, Kubernetes, SQL, Python, Python, Communication, Decision-making, Decision-making, Critical thinking, Adaptability, Needs improvement in time management,
557, Employee 557, Java, SQL, CSS, JavaScript, AWS, Decision-making, Conflict resolution, Leadership, Time management, Critical thinking, Needs to work on problem-solving skills,
558, Employee 558, Kubernetes, SQL, Kubernetes, HTML, Kubernetes, Critical thinking, Leadership, Teamwork, Communication, Teamwork, Great work!,
559, Employee 559, AWS, Kubernetes, Java, SQL, SQL, Adaptability, Creativity, Adaptability, Creativity, Problem-solving, Leadership potential,
560, Employee 560, Azure, Java, SQL, Java, AWS, Critical thinking, Teamwork, Decision-making, Adaptability, Communication, Needs improvement in time management,
561, Employee 561, Azure, CSS, Kubernetes, AWS, HTML, Time management, Conflict resolution, Communication, Critical thinking, Decision-making, Adapts well to changes,
562, Employee 562, HTML, Java, SQL, Azure, Python, Leadership, Time management, Teamwork, Communication, Time management, Adapts well to changes,
563, Employee 563, Java, Java, Docker, AWS, Kubernetes, Decision-making, Adaptability, Time management, Decision-making, Teamwork, Needs to improve attention to detail,
564, Employee 564, Docker, AWS, Python, Kubernetes, Kubernetes, Problem-solving, Critical thinking, Communication, Conflict resolution, Critical thinking, Adapts well to changes,
565, Employee 565, Docker, AWS, JavaScript, SQL, SQL, Leadership, Critical thinking, Decision-making, Creativity, Decision-making, Adapts well to changes,
566, Employee 566, Java, SQL, HTML, Docker, CSS, Conflict resolution, Critical thinking, Creativity, Adaptability, Problem-solving, Good communication skills,
567, Employee 567, Docker, HTML, Docker, HTML, Kubernetes, Problem-solving, Communication, Decision-making, Communication, Adaptability, Needs to work on problem-solving skills,
568, Employee 568, Python, HTML, Azure, Python, Docker, Communication, Critical thinking, Decision-making, Teamwork, Communication, Needs to work on problem-solving skills,
569, Employee 569, AWS, Python, Docker, Docker, Kubernetes, Problem-solving, Leadership, Adaptability, Time management, Decision-making, Leadership potential,
570, Employee 570, Java, SQL, AWS, Python, AWS, Creativity, Creativity, Adaptability, Creativity, Time management, Excellent teamwork,
571, Employee 571, Docker, Python, Java, Kubernetes, AWS, Leadership, Time management, Adaptability, Critical thinking, Teamwork, Needs to improve attention to detail,
572, Employee 572, AWS, AWS, Java, Python, Python, Adaptability, Teamwork, Creativity, Decision-making, Problem-solving, Needs improvement in time management,
573, Employee 573, Python, Python, HTML, Kubernetes, Java, Decision-making, Teamwork, Teamwork, Creativity, Critical thinking, Very creative,
574, Employee 574, AWS, CSS, SQL, Azure, Docker, Decision-making, Leadership, Communication, Time management, Time management, Shows good decision-making skills,
575, Employee 575, HTML, Python, Azure, Python, Docker, Decision-making, Adaptability, Adaptability, Creativity, Conflict resolution, Great work!,
576, Employee 576, Docker, CSS, CSS, Python, SQL, Leadership, Adaptability, Communication, Conflict resolution, Problem-solving, Excellent teamwork,
577, Employee 577, Java, AWS, Docker, Azure, Java, Creativity, Critical thinking, Decision-making, Adaptability, Conflict resolution, Shows good decision-making skills,
578, Employee 578, CSS, Docker, Kubernetes, Java, Kubernetes, Communication, Time management, Leadership, Critical thinking, Conflict resolution, Needs improvement in time management,
579, Employee 579, Docker, Docker, Java, Azure, CSS, Critical thinking, Teamwork, Decision-making, Leadership, Adaptability, Good communication skills,
580, Employee 580, Python, AWS, Kubernetes, CSS, Java, Critical thinking, Creativity, Leadership, Communication, Teamwork, Good communication skills,
581, Employee 581, Kubernetes, Python, Docker, CSS, HTML, Communication, Creativity, Creativity, Teamwork, Time management, Great work!,
582, Employee 582, CSS, Python, SQL, Python, Python, Adaptability, Conflict resolution, Time management, Critical thinking, Communication, Needs improvement in time management,
583, Employee 583, Java, Python, Java, Kubernetes, Azure, Adaptability, Leadership, Decision-making, Creativity, Time management, Good communication skills,
584, Employee 584, SQL, SQL, Docker, SQL, JavaScript, Adaptability, Critical thinking, Adaptability, Decision-making, Adaptability, Great work!,
585, Employee 585, JavaScript, Azure, Docker, Python, Kubernetes, Conflict resolution, Adaptability, Adaptability, Decision-making, Leadership, Leadership potential,
586, Employee 586, HTML, Python, Python, Docker, Azure, Decision-making, Problem-solving, Critical thinking, Communication, Creativity, Needs improvement in time management,
587, Employee 587, Python, HTML, Docker, Python, Docker, Decision-making, Conflict resolution, Conflict resolution, Time management, Decision-making, Excellent teamwork,
588, Employee 588, Java, Java, Azure, SQL, Azure, Time management, Leadership, Time management, Conflict resolution, Critical thinking, Needs to improve attention to detail,
589, Employee 589, Java, Java, SQL, SQL, AWS, Creativity, Problem-solving, Critical thinking, Critical thinking, Adaptability, Good communication skills,
590, Employee 590, Azure, CSS, Azure, HTML, AWS, Problem-solving, Conflict resolution, Creativity, Communication, Conflict resolution, Great work!,
591, Employee 591, Azure, SQL, JavaScript, Kubernetes, Python, Conflict resolution, Leadership, Creativity, Adaptability, Problem-solving, Great work!,
592, Employee 592, Python, CSS, HTML, Java, Python, Creativity, Leadership, Time management, Teamwork, Problem-solving, Shows good decision-making skills,
593, Employee 593, CSS, CSS, HTML, Kubernetes, Azure, Time management, Leadership, Adaptability, Problem-solving, Conflict resolution, Shows good decision-making skills,
594, Employee 594, SQL, HTML, Docker, Python, Docker, Conflict resolution, Communication, Adaptability, Critical thinking, Adaptability, Shows good decision-making skills,
595, Employee 595, Docker, Docker, JavaScript, AWS, Docker, Problem-solving, Critical thinking, Teamwork, Creativity, Critical thinking, Needs to work on problem-solving skills,
596, Employee 596, HTML, HTML, SQL, HTML, AWS, Time management, Conflict resolution, Conflict resolution, Time management, Problem-solving, Adapts well to changes,
597, Employee 597, Azure, Azure, CSS, Kubernetes, JavaScript, Problem-solving, Time management, Adaptability, Problem-solving, Critical thinking, Very creative,
598, Employee 598, Docker, Java, Docker, CSS, HTML, Problem-solving, Conflict resolution, Adaptability, Conflict resolution, Critical thinking, Good communication skills,
599, Employee 599, Python, Docker, Kubernetes, HTML, Python, Critical thinking, Time management, Adaptability, Leadership, Time management, Good communication skills,
600, Employee 600, Python, JavaScript, Python, CSS, Docker, Teamwork, Creativity, Problem-solving, Decision-making, Adaptability, Good communication skills,
601, Employee 601, AWS, Azure, Kubernetes, HTML, AWS, Communication, Adaptability, Problem-solving, Adaptability, Adaptability, Needs to work on problem-solving skills,
602, Employee 602, SQL, Kubernetes, CSS, Kubernetes, CSS, Time management, Time management, Communication, Conflict resolution, Creativity, Needs improvement in time management,
603, Employee 603, Docker, Azure, Python, HTML, Kubernetes, Conflict resolution, Decision-making, Leadership, Adaptability, Problem-solving, Needs to improve attention to detail,
604, Employee 604, Java, Docker, HTML, AWS, Azure, Conflict resolution, Adaptability, Communication, Critical thinking, Decision-making, Shows good decision-making skills,
605, Employee 605, Kubernetes, Python, CSS, SQL, Python, Conflict resolution, Time management, Conflict resolution, Critical thinking, Problem-solving, Needs improvement in time management,
606, Employee 606, HTML, CSS, JavaScript, Azure, Java, Conflict resolution, Leadership, Leadership, Problem-solving, Conflict resolution, Needs to improve attention to detail,
607, Employee 607, Kubernetes, SQL, Azure, SQL, CSS, Problem-solving, Time management, Time management, Time management, Problem-solving, Good communication skills,
608, Employee 608, Kubernetes, SQL, JavaScript, Azure, Kubernetes, Teamwork, Creativity, Communication, Problem-solving, Conflict resolution, Needs to improve attention to detail,
609, Employee 609, Azure, Azure, JavaScript, AWS, CSS, Teamwork, Conflict resolution, Teamwork, Communication, Communication, Very creative,
610, Employee 610, AWS, SQL, HTML, HTML, Docker, Leadership, Leadership, Creativity, Teamwork, Conflict resolution, Adapts well to changes,
611, Employee 611, JavaScript, SQL, CSS, HTML, HTML, Adaptability, Conflict resolution, Creativity, Decision-making, Leadership, Shows good decision-making skills,
612, Employee 612, AWS, HTML, CSS, Java, Python, Creativity, Problem-solving, Time management, Problem-solving, Time management, Good communication skills,
613, Employee 613, Docker, Java, AWS, Java, AWS, Conflict resolution, Decision-making, Communication, Problem-solving, Conflict resolution, Very creative,
614, Employee 614, CSS, JavaScript, AWS, SQL, AWS, Conflict resolution, Problem-solving, Conflict resolution, Teamwork, Teamwork, Very creative,
615, Employee 615, Docker, Azure, Docker, HTML, CSS, Teamwork, Conflict resolution, Conflict resolution, Problem-solving, Leadership, Adapts well to changes,
616, Employee 616, Python, Kubernetes, Azure, JavaScript, JavaScript, Teamwork, Teamwork, Teamwork, Teamwork, Decision-making, Needs improvement in time management,
617, Employee 617, HTML, Java, Azure, Python, Docker, Adaptability, Time management, Conflict resolution, Conflict resolution, Problem-solving, Needs improvement in time management,
618, Employee 618, HTML, JavaScript, HTML, Java, AWS, Time management, Creativity, Critical thinking, Conflict resolution, Adaptability, Needs to work on problem-solving skills,
619, Employee 619, AWS, Python, Docker, Azure, AWS, Leadership, Critical thinking, Creativity, Conflict resolution, Leadership, Needs to work on problem-solving skills,
620, Employee 620, Java, Python, CSS, Java, Azure, Communication, Adaptability, Teamwork, Conflict resolution, Creativity, Good communication skills,
621, Employee 621, CSS, Azure, Kubernetes, Docker, Docker, Creativity, Teamwork, Adaptability, Critical thinking, Teamwork, Needs to improve attention to detail,
622, Employee 622, JavaScript, Docker, AWS, Java, JavaScript, Problem-solving, Time management, Creativity, Adaptability, Communication, Adapts well to changes,
623, Employee 623, CSS, Kubernetes, SQL, Docker, SQL, Adaptability, Communication, Leadership, Decision-making, Decision-making, Needs improvement in time management,
624, Employee 624, Python, AWS, Python, AWS, Azure, Conflict resolution, Creativity, Adaptability, Decision-making, Teamwork, Very creative,
625, Employee 625, AWS, Python, Python, Java, Docker, Communication, Creativity, Creativity, Problem-solving, Adaptability, Great work!,
626, Employee 626, Python, CSS, HTML, Azure, Docker, Leadership, Teamwork, Creativity, Leadership, Adaptability, Excellent teamwork,
627, Employee 627, Python, Python, SQL, HTML, Azure, Leadership, Communication, Critical thinking, Communication, Problem-solving, Needs improvement in time management,
628, Employee 628, HTML, JavaScript, CSS, JavaScript, Kubernetes, Adaptability, Problem-solving, Decision-making, Adaptability, Creativity, Needs to work on problem-solving skills,
629, Employee 629, Python, AWS, HTML, Python, Docker, Decision-making, Problem-solving, Conflict resolution, Conflict resolution, Creativity, Needs to improve attention to detail,
630, Employee 630, Azure, Kubernetes, CSS, CSS, Java, Problem-solving, Communication, Critical thinking, Decision-making, Creativity, Excellent teamwork,
631, Employee 631, SQL, CSS, Docker, Docker, Python, Communication, Adaptability, Time management, Problem-solving, Time management, Needs improvement in time management,
632, Employee 632, Kubernetes, AWS, Kubernetes, CSS, Java, Adaptability, Teamwork, Conflict resolution, Critical thinking, Critical thinking, Shows good decision-making skills,
633, Employee 633, AWS, HTML, AWS, AWS, CSS, Critical thinking, Leadership, Problem-solving, Critical thinking, Decision-making, Needs improvement in time management,
634, Employee 634, HTML, CSS, Azure, Python, HTML, Creativity, Leadership, Adaptability, Conflict resolution, Conflict resolution, Excellent teamwork,
635, Employee 635, JavaScript, Docker, JavaScript, Java, Docker, Adaptability, Adaptability, Problem-solving, Decision-making, Creativity, Shows good decision-making skills,
636, Employee 636, CSS, CSS, AWS, JavaScript, JavaScript, Leadership, Communication, Problem-solving, Communication, Adaptability, Good communication skills,
637, Employee 637, JavaScript, Java, JavaScript, AWS, Azure, Problem-solving, Communication, Time management, Critical thinking, Teamwork, Very creative,
638, Employee 638, CSS, AWS, SQL, Python, SQL, Time management, Decision-making, Time management, Creativity, Conflict resolution, Good communication skills,
639, Employee 639, JavaScript, Azure, Python, CSS, AWS, Teamwork, Leadership, Leadership, Creativity, Communication, Needs to work on problem-solving skills,
640, Employee 640, SQL, HTML, AWS, HTML, Java, Creativity, Adaptability, Decision-making, Decision-making, Teamwork, Excellent teamwork,
641, Employee 641, Docker, Kubernetes, AWS, Java, Java, Critical thinking, Problem-solving, Conflict resolution, Communication, Creativity, Good communication skills,
642, Employee 642, CSS, Python, CSS, CSS, CSS, Conflict resolution, Teamwork, Time management, Creativity, Conflict resolution, Needs to improve attention to detail,
643, Employee 643, Kubernetes, SQL, AWS, HTML, JavaScript, Leadership, Time management, Critical thinking, Teamwork, Critical thinking, Needs to work on problem-solving skills,
644, Employee 644, Python, Azure, Docker, HTML, Java, Teamwork, Time management, Decision-making, Leadership, Critical thinking, Leadership potential,
